"Miss <PERSON> (as I hand out the new spelling lists): Don't lose your spelling lists because there are no more copies of these bad boys.\  Class (whispers and head bobbing): \""Bad boys""", 5
I'd very much like some peach pie or peach cheesecake right now.  Somebody make this happen plz., 5
I really wanted chicken and brown beans., 5
Examining oral cavity anatomy tomorrow (only after cutting a head in half). Bring it on!, 5
thinking about going blonde.. hmm needs a bloody job, 5
Eating with the famz..., 5
Gonna clean out my car today... maybe they will take it as a trade in later this week.. maybe not, 5
"in brawl the two excuses my brother uses after he loses is im not even trying\ and \""you got lucky\"".\""""", 5
3hrs  2 go n then im 14, 5
think am falling in love with Mauritius ...and its cultural diversity.., 5
why do ppl continue to complain about situations that they created themselves...u chose to be with this man/woman and u chose to have children so deal with the consequences, 5
Checking my salad for messages, 5
">,-[)", 5
is doing great.... lol. If I had learned this stuff when I was supposed to I guess I wouldn't have to cram right now. Oh well. There's always next year... or grade 12., 5
"hey guys, just got bak on my first day of skiin", 5
would love to go back to bed., 5
Is in a slipknot mood >:o, 5
What do you know? The first post I see on MLIA is about Harry Potter. MLIA., 5
... I'll chase you thru the house and all thru the yard, 5
<PERSON>add me on xbox live !, 5
The wind of evolution is blowing hard.Man must adapt to the inevitable change and adjust his unnecessary desires, 5
Mother Earth.. in the Black Symphony album is epic... and x.x German tutorial then food festival? blech.. *dies inside*, 5
I offically hate my brother.........Spartacus Blood and Sand. Incrediable, 5
jlweagfnakwelak4hyjihj3035iy2ow4hj3jyhu2jy2jioagkdavbnjhn hq  Why is everyone so obsessed with how much wood a woodchuck could chuck?[/color], 5
"ITS HIGH TIME I ADDED PPL I WANT TO ,TO MY FRIEND LIST.", 5
Love is gigantic and unspoken.LOVE IS BLIND BUT WE ARE NOT BLIND, 5
"i'm a supergirl, and supergirls don't cry...or do they? or am i not a supergirl at all??", 5
And the band played Waltzing Matilda..., 5
"want to run, run but don't know from where nor to where ,, just run ...   <PERSON>", 5
LYL, 5
new music, 5
ggfdfdfdfdf, 5
the third crossroad must be the most difficult.... hold on to the memories or let go to start anew?, 5
"A true friend        doesn't care if you're        broke, when your house is        a mess, about your past, or        if your family is filled with        crazies...They love you for        who you are. A true friend        can go long periods of time        without speaking to you        and never question the friendship.", 5
I'm willing to admit that I may not always be right, 5
"If God's the game that you're playing	Well, we must get more acquainted	Because it has to be so lonely... to be the only one who's holy", 5
OHYERH XD, 5
Interesting video for a man with butter fingers., 5
cuddling with lukas in my bed hes so fluffly!!! but only if....., 5
back to the way things are suppose to be, 5
want my hair to grow faster!, 5
is bye bye wisdom teeth!!, 5
Hey yall. I'm going to tennis camp tommorow., 5
definatly go see Inception if ya havent, 5
I adpoted a solider and james asked what is the program and mom told him its where we move him into your room! lets just say james didnt like that idea..., 5
"Netflix movies that arrived today: Fool's Gold\ and \""Definitely""", 5
"At last, the sun is beginning to set later.  4:43 yesterday; 4:44 today.", 5
"I have made an observation: the more senior the person, the more smartly dressed they are during the day, but interestingly, the more casually dressed they are in the evening.", 5
"I can tell whenever someone enters my server, even when I'm not on Minecraft or are looking at the software.		The lag spike slows my music.", 5
just got back from livesAblaze, 5
Copy this into your status and see what people rate you. 1:Crazy. 2:I'd Marry You. 3:Talkative. 4:Sarcastic. 5:Lovable. 6:Clubhead. 7:Moody. 8:Dumb. 9: Spoiled. 10:Mouthy. 11:Random. 12:Hot. 13:Funny. 14:Fit. 15:Amazing. 16:Tough. 17:Cute. 18:Bf/Gf Type. 19:Player. 20:The Best. 21:Freak. 22:Quiet. 23:Sexy. 24: Adorable. 25: Annoying. 26: Rude. 27:Boring. 28: Trust-Worthy. 29: Life Saver., 5
You look into the mirror  of Erised.  What do you see?, 5
Gain Muscle and Maintain    Bodyfat Level                              Current Weight            Calories            Protein, 5
should be looking for a job right now., 5
Is quite exhausted by many things and wishes she could see and hug <PERSON> (will be soon hopefully) and get away into the country as well as have a couple of drinks!!!, 5
I'm back! And not a moment too soon, 5
Senior night!!!! ^^, 5
I have a problem - f(x) = exp(((log(((((a^2) + 1)*((x / (f * 100)).^(2*e))+(b^2)))) - log(((1/(d^2)) - (((a^2) + 1) - 1)))) * (1/(2*e))) + (log(1/c))) * 100, 5
Has too catch them all! Want to trade a Bullbasaur for a Weezing?...................well answer me foo., 5
"ok, a shout out a receny friend of mine left everything she new to help her sick sister's family,... her sister died yesterday. any warriors want to take up swords twould be a good battle. i just want Fathers pressence felt and know in these times of difficult choices three children and a spouse", 5
"It takes courage and honesty to see ourselves as we really are, but it's the only way to become the kind of people we want to be.", 5
who wants to go chow yang pasar mlm tonite n can fetch me one leh??, 5
WTF!? a dog out side just let out 3 howls that sounded like an air raid siren....only a bit lower frequency....freaking eerie sounding..., 5
...And boom goes the dynamite., 5
Yes, 5
trust takes year to build and seconds to destroy, 5
the snow and cold weather is great...but i dont want to go to skool in the summer, 5
"i run over a fork on ur car, coz im a ninja!! lol", 5
NMCMLL its hard and stoof..., 5
man who knew drawing could be so fun...and tireing at the same time life is good though, 5
... feel the emo inside me stirring........  must.......resist...emo urges........., 5
"According to Urbandictionary.com: <PERSON>=1. a person who uses the services of a prostitute          2. a very extremely confusing guy. shows that he has feelings for you sometimes, but then might just randomly stop talking to you at any time. very flirtatious. manwhore. will lead you on. hilarious. full of charisma. you have to love him. boys are jealous of him. girls are jealous of the girl he is flirting with", 5
Capricorn A journey of self-improvement ends almost before it starts when you find out there's a kind of waffle stuffed with cheese and booze., 5
What's a guy gotta do to get a girl in this town Don't wanna be alone when the sun goes down Just a sweet little something to put my arms around What's a guy gotta do to get a girl in this town, 5
Ik im dumb but u gotta love me... u gotta love me right? xD, 5
is at her cousin's house, 5
Chouiefat People that thinks mr.<PERSON> teaches better football than our school he is wrong i won yesterday 2 boys 10-1, 5
"is enjoying my last day of leave :(... Working on my new song before I get back to morrow to sort out Project Awards, Photo Competition Bridge Building and writing my new article for CE magazine...", 5
Like         this status & I'll answer it honestly 1. When did I meet you? 2. Do         you mean alot to me? 3.What do I think of you? 4. Have I ever gotten         mad at you? 5. Are you nice or mean? 6. WouldI care if I lost you? 7.         Would I date you? 8. Have I ever had a crush on you? 9. Do I enjoy being         your friend? 10. Do I... miss yo...u? 11. Do I love your hugs? 12. Do I like your smile?, 5
i like it on your moms bed, 5
i need a massage......, 5
It's going to be a long day tomorrow...., 5
"the wedsite asks what is on my mind. there is nothing on my mind, just in it. silly website", 5
"The weak can never forgive. Forgiveness is the attribute of the strong......\\""""", 5
It takes 7 secs for food to pass from mouth to stomach. A human hair can hold 3 kg. The length of a penis is 3 times the length of the thumb. The femur is as hard as concrete. A woman's heart beats faster than a man's. Women blink twice as much as men. We use 300 muscles just to keep our balance when we stand. The woman has read this entire text. The man is still looking at his thumb. Repost if this made you smile!, 5
"Cus you thought you'd win, 	but I'd knew you'd lose, 	Honey, I'm flyer than altitude cruise,", 5
Crisis! I have run out of Marmite!!!! :-(, 5
"must be mad ta get up at. 5 in the morning on my day of to go fishing ,,,,", 5
Damn it's hot!!!, 5
I don't want to grow old. I want to stay the way i am right now forever, 5
"LMAO, it wasnt my birthday on the 1st ROFFL", 5
my siss's bday is coming up!! what do i get her?... oh ik! how bout apair of Jordans?! wait no thats what i want..., 5
"Google won't search for Chuck Norris because it knows you don't find Chuck Norris, he finds you.", 5
thinks that he might be slightly addicted to FarmVille.  I wonder if there's a 12 step program., 5
To all my friends who had Restaurant City..Please please gift my friend Donny Chan please.., 5
is now 22 years old..., 5
is drinking australian <PERSON>to try how it helps under sleepless, 5
H1N1 Visits FAFB...How do you feel about it?, 5
Porto gonna get gunned by arsenal 2night, 5
i'm sleepy, 5
The roof! The roof! the roof of walmart's on fire!......Hahahaha, 5
it is raining, 5
Midnight In Motion Lyrics Page Complete, 5
is a lover not a fighter.. but he's a fighter too so don't get any ideas, 5
nice day maybe i should do something.........nah, 5
im so good at sleep i can do it with my eyes closedÃ¢â‚¬Å’, 5
Well i better go. Bye, 5
....What it look like......lol....., 5
"..is moonwalkn on water, wit bricks tied around his kicks.", 5
"not yet done with my APE... having lunch with Dadi Jay in Pepper Lunch, EDSA Shangri-la", 5
i finally finished my project!!! . . . but i still got tutor homework ='[, 5
Goodnight., 5
"*insert some witty, funny, and/or bitching about my job status message here*", 5
What to do? What to do?, 5
fight tomorow yall needa go be a good fight, 5
thinks it's weird that Facebook deleted half of his wall..., 5
feels like I woke up in a different apartment..., 5
"Ã¢â‚¬Å“We are ready to get this done today but there has to be movement on all sides to recognize that it is better for us to act than to talk. Better for us to choose action over inaction; the future over the past. With courage and faith, I believe that we can meet our responsibilities to our people, and to the planet.Ã¢â‚¬Â-the President", 5
LOST 20lbs JUST NEED TO LOSE 40 MORE, 5
"Ohhh, bored.. Someone should see if I can hang out with them...", 5
"Some say the world will end in fire, Some say in ice. From what I've tasted of desire I hold with those who favor fire. But if it had to perish twice, I think I know enough of hate To know that for destruction ice Is also great And would suffice.", 5
whats going on today? its 11 am and im already bored. Hit me up, 5
"Everything we hear is an opinion, not a fact. Everything we see is a perspective, not the truth", 5
Wow!first day of scol, 5
"Before you criticize someone,	 you should walk a mile in their shoes. That way, when you criticize 	them, you're a mile away and you have their shoes.", 5
needs a pair of nice heels/boots... hmm, 5
Giving in to nostalgia, 5
I am getting ready to go out in the real world and cut me some trees..... can someone please ask someone in charge to pay the heat bill?  it's a little chilly!!!!, 5
"goal number 1, graduate school and get a job:CHECK been there done that. Goal number 2, become fluent in spanish and star in a spanish soap opera: in progress", 5
Watching Lost Boys and being all mopey....., 5
"Listening to Judas Priest, drinking Jameson whiskey, and updating facebook.", 5
JST WANT MY BED, 5
"Please hold, your status messages are important to me.", 5
its funny when she feels like shes the only one thats fighting to fix things when ive given up everything and done everything shes asked no questions and no arguements and still im reminded that after everything im still not making a difference, 5
Wow, 5
live today, 5
gudnyt guys.. gudmurning na rin.., 5
Heard blues by the bay from my house... Did a ton of laundry. Did a dump run.. And went to my moms and stacked wood. Now i'm helping fold 10baskets of cloth., 5
My stomach was making the rumblies        <PERSON>     That only hand would satisfy, 5
One more week till we move to jersey! Bitter sweet, 5
I'll add more later., 5
oh so tirrred.. to behave? or not to behave........, 5
every one press up up down down left right left right B A enter up down then circles will appear on your facebook page to get them off refresh page, 5
makaboring!!!! work na2man, 5
ya, 5
"<PERSON>, Anthropologist", 5
Fell asleep way too early dude now im up!, 5
PISS N LOVE, 5
Finished positive-and-negative decimal-to-binary converter. Just realized how simple this is..., 5
Love is a kind of torment as a lover should endure, 5
Is addled due to his ''sweet tooth'' and wishes the ants were here. *_*, 5
who hates me thumbs up?, 5
"If I'm not rollin' like a rockslide, I'm layin' in da cut like peroxide!", 5
hahaha. . . I spam my own page. . ., 5
"Quotes from tiffs b-day...OMG! My pants have gone AWOL!... Why does it feel like someone pissed on me! Are those special brownies! Made with happieness! There's no point... It's dead, there's no point ( bliss laughing maniacally)", 5
@Cardiff, 5
Heading to the gym...need to get my sorry a$$ back in shape!!, 5
Busy day tomorrow should probably start my homework, 5
I'm getting ready to cook supper. On the menu tonight... Parmesan Crusted Chicken with Fettuccine and Alfredo Sauce., 5
"Let's see who is paying attention. Every single one of you are on my friends list, as a result of a conscious decision. I wanted you there! I am not only glad to count you as friends, but also as family. Let's see who on my friends' list actually pays attention. Copy and paste this as .........your......status.... I'll be watching to see who repost and comments.", 5
so does anybody know anything about the haunted house in Alpharetta that will give you 1000 dollars if you make it to the top floor? it's 13 stories, 5
Am I the only one who thinks valentines day isn't that bad?, 5
"sooo tired, I love my bed", 5
cs61a blows my mind every week., 5
When you hear the banjo music....that means run., 5
"There is no instance of a country having benifited from prolonged warfare.\ - Sun Tzu\""""", 5
i like it on the kitchen counter, 5
Awww Mann..., 5
what would it take for things to be quiet? Quiet like the snow. xD, 5
"the REAL lyrics of the chorus to DYNAMITE, i throw my skittles in the air sometimes saying he yo! taste the rainbow", 5
If the facts don't fit the theory, 5
"Anyone who knows someone who has had cancer, should check this documentary out, very interesting. Its called The Beautiful Truth\. 		<URL>""""", 5
TIME IS ART, 5
"I dont do drugs, I just take medication!!!", 5
Did you know... the bird is the word!!!!!, 5
Wish i was still in Portugal It was animal Defo goin next year, 5
..................................................:P, 5
2010 blink and you will miss it its flying along time machine anyone....., 5
fixin 2 go crazy blaaaaaaaaaa i just did bamaboyz 4 life, 5
i'm not dirty as yo think I am!, 5
Blank, 5
"I don't know where it's all coming from-this barrage of fantastical thoughts-but I only have 10,000 more to go! Agh! *whispers* Seven days....", 5
Transfers this week...., 5
I like Artest., 5
"What's on your mind?September is cancer month. In memory of every cancer patient, family member and friend that lost their battle with cancer and in honor of those who continue to conquer it! Put this up for 1 hour if you love someone who has or had cancer. Many won't copy and paste I did, will you?", 5
Should I put better pics of myself up on fb or take off pics from my album...thoughts?, 5
You call can now call me.... The Weedman!!!!!, 5
"Aglow from all the possibilities ahead of me. Now, how to make them happen...hmmm...", 5
"Imvu(many things to do ,) ) <URL>", 5
"Well, I am FINALLY back from my mission, and... well, .... like most returned missionaries, I am wondering what has happened to all my friends and aquantances.  Absolutely EVERYONE is on facebook (in fact, I think it is taking over the world), and so I figured I could join in and find everyone.", 5
...went driving today....almost died ! ps. jess is shaving my legs as we speak :), 5
"3 Feb 2010,Today I a bit sick.<PERSON>ask me to go to general office,sickbay to rest.After 1 hour,I return to his lesson.", 5
just got my braces put on, 5
sleeps better on the cold nights...Algernon doesn't wake up as much...?, 5
"Please copy and paste this to your status if you know someone, or have been affected by someone, who needs a smack upside the head. People who need a smack upside the head affect the lives of many. There is still no known cure for someone who deserves a smack upside the head, except a smack upside the head,... but we can raise awareness. Many won't copy and paste this. I did. Will you?", 5
"octopus prediction  spain will win the cup\\""""", 5
just woke up from a deep sleep. time to eat some cereal yo, 5
"Men judge generally more by the eye than by the hand, for everyone can see and few can feel. Everyone sees what you appear to be, few really know what you are. -<PERSON>", 5
Do it in the woods!, 5
"God is not a man, so	he does not lie.	He is not human, so	he does not change	his mind.	Has he ever spoken and	failed to act?	Has he ever promised	and not carried it	through?", 5
"I am going to be without the internet for an indefinite amount of time, I don't have a mobile either so if anyone needs to contact me please use smoke signals. ty", 5
rabbit! tomorrow, 5
School is about to start!, 5
Writing about an idea frees me of it - <PERSON>, 5
is waiting for one more week to go by and be back in Murray., 5
On to the next one..., 5
Skol Vikings, 5
"really wants to see the movie year one\ - is okay too""", 5
has been a subject to a lot of policy routing on the way home due to flooding caused by a heavy rain. Policy routing was implemented by cars with blinking blue lights standing 90 degrees to the direction of the road., 5
"Carriere Woman Faces Federal Tax Charges<PERSON> Accused Of Preparing False Tax Return March 4, 2010 GULFPORT, Miss. <PERSON> County woman is facing federal charges for helping prepare a false tax return for two individuals.<PERSON>, of Carriere, pleaded not guilty Wednesday to one count of aiding and assisting in the preparation of a false 2005 tax return.", 5
"274267 Shinobi Shozoku\ set925678 \""Garb of the Great Merchant\"" set437626 \""Armament of Germania\"" set373624 \""Armament of Gaul\"" set\""""", 5
Ã¢â‚¬Å“You have indeed in the Messenger of Allah (swt) a beautiful pattern (of conduct)Ã¢â‚¬Â¦ (33:21), 5
Two words.  <PERSON> is one of the sickest players around....period.....ok so that was more than two words....don't judge me.., 5
HEAR YE HEAR YE...Mistress Stephanie at the Chain Drive tomorrow night at 10 and at the Beauty Bar this Friday at 7:00.  Do come., 5
NOBEL PRIZE IS NOT GIVEN FOR MATHS MATHS.YOU KNOW WHY????????????? reply the answer . HURRY!!, 5
Today is paintball day time for more pics and pain, 5
"You and I wake up in a police cell together. Using only 4 words, what would you say to me? Note: If you comment, you must copy and paste this to your status, so I may comment on yours as well.. Be a good sport and play along... 4 words is harder than you think", 5
limpezas day..., 5
"registered to vote today. tking wife to do the same tomorrow... oct 8 is the deadline. whatever you beleive, please do this. in a democracy you get the leaders you deserve", 5
Needs  a partner in Crime!!!, 5
fuk a bitch stack chips get money!!, 5
As usual going to work right now..., 5
"Calling ALL MODELS!!!!!!! Model Call Wednesday, April 14th 2010 @ <ADDRESS>. Registration begins @ 7 pm SHARP!!!! Only $40, includes televised interviews, photoshoots, free admission to the Pre Freaknic Party beginning @ 11 pm later that night.", 5
Our Wedding Anniversary tonight..., 7
getting ready for the big move people, 7
would like to send a shout out and thanks to his little helper this weekend., 7
going to atl this weekend to see my mawmaw, 7
Hot pot!, 7
"6 down, 3 to go, come on S4S! Make me a happy guy! :)", 7
Got my new tat! I got it on my cest. I didnt get to finish it cuz it hurt too fucking much. Fuckin awesome lookin tho, 7
Reggie Bush is the MAN!!!!, 7
Finally got a working phone again....and its nice!, 7
"Thanks for the B-day wishes everybody! I had a great day...Saints mopped the floor with the Giants(5-0 Woo, Hoo!), then we had sushi! Who could ask for more?!", 7
fun in the sun!!, 7
wow so many people from school have found me lately. i'm really happy that they even remember me. i miss you guys, 7
"Happy bday to my angel <PERSON>...I miss you and love you. See you soon...\""""", 7
"Yay~ going to Ontario Mills with <PERSON> and <PERSON> For her birthday~ >u< Pfftt but she's late, as I expected... =3=#", 7
Wow-so many bday wishes continue to come-thanks so much everyone!...and I have to give a shout out to the BEST sous chef working to prepare us an awesome dinner at the Hyeholde in Moon-Amy Hebster's man-<PERSON>!!, 7
I GOT DEM BRAIN DAWGS!, 7
Wow... Dad. Awesome moment of my teenage life? I think it falls in there. Thanks! =], 7
You guys are great., 7
"tHANk U EVERy1 4 All tHE HAPPy BDAyS . i HAD fUN , DiNNER N a MOViE tHANkS BABE .", 7
is touched by all the birthday wishes. THANK YOU ALL!!!!!!!!!!!!!!!! XOXOXOX  My smile is so big it can split my face !!! :))))))))))))))))), 7
"Had a LOOONGG but great day at work... now its time to sit back and relax the best way i can ,)", 7
One mo gen upportin one of ma boyz as they take dat plunge BEST WISHES <PERSON> AND <PERSON> Im honored to stand with you as you embark on the next chapter in your life.  LOVE YOU GUYS LIKE A PLAY COUSIN!, 7
"After such a long time, I finally get to receive  my package!!! Although I need to declare my medical status, I don't  need to do any medical checkup!! WOOTS !!! :D", 7
Wow! Fun wedding =P Congradulations <PERSON> and <PERSON>!, 7
yayy! electric guitar!!, 7
"Thanks for all the B-day wishes.  Unfortunetly, I've been sick since then.  But I'm better now and just in time to leave tomorrow for PUERTO RICOOOO!!!", 7
My birthday is tomorrow!!!! so excited, 7
thanks for the birthday wishes everyone!!!, 7
Summmerrrsss baaaccckkkk!!!! God i missed fb!!!, 7
is having such a great day!! thanks so so much for all of the birthday wishes/blessings/love!!!, 7
is enjoying her day off!!, 7
YOUMACON WAS ABSOLUTELY AMAZING GONNA START GETTING READY FOR NEXT YEAR VERY SOON, 7
Goodluck guys!..., 7
tryouts 2day!!! im so excited, 7
"Last night was amazing! Not only did I see Anthony Rapp and Adam Pascal's LAST performance of RENT, but we also ended the night at 3 Fires Lounge were the whole cast was celebrating!", 7
Thanks for all the B day wishes!!, 7
"dam fresh memories....that shit was too funny cuzin! man i had a ball wit you and kinfolks!lmao! dont trip, im comin in december fa sho. i know ms.mom gonna be feastin around that time too... oh im there! and this time maybe we can make it to your pad!lmao! love you cuzo.peace", 7
24th birthday is now officially: BEST BIRTHDAY EVER, 7
fun night out! excited for tomorrow!, 7
Man its a beautiful day think im gonna go for a drive... dont know where and dont know how long... T tops will be off and music will be a blastin thats for sure!, 7
"thank you all for your wonderfull sentiments it meant alot, never in my life do i remeber gettig so many greetings it was nice. i had a wonderfull day and a wonderfull time at my moms and i lit up her path to the barns this year, NO MORE FLASHLIGHTS YEA!!  and my horse has lights too she scared of the storms up here for some strange reason. i love my mama", 7
YAY!!! I GOT MY PASS BACK!!!, 7
yipeeeee !, 7
I'm excited to have just purchased a bunch of new workout clothes! Wo-HOO! There's no better motivation in my book!, 7
The photos rock! Thanks Fiona! * Hugs *, 7
would like to say a huge thankyou for all the lovely birthday wishes. i had a lovely relaxed day now i am getting old this is all my body can take., 7
is so glad to be home from work.Merry Christmas to all., 7
Thank you everyone you make me feel so loved :), 7
"Happy 4th yo! Now, let's see some pretty lights and explosions...not necessarily in that order in or in same time frame! XD", 7
Cant wait till wednesday cause im goin to Angels house and not goin home till Monday!, 7
Tonite...let me think...:))) it's gonna be FUN!!, 7
I am so excited for tomarrow !!!!!, 7
ITs great morning to hit the gym!!!!, 7
Happy new Year yall, 7
"friends do come and go,,, and I'm very thankful for those who chose to stay,,, 'coz they think that I'm a PERFECT FRIEND for them.. through all the trials we encountered, still, we stick together!! i love you GFs & BFs!!!", 7
merry christmas everyone!!!!!!!!!!!!!!!!!!!!!!!, 7
just got bk frm spain nd im soo tired but got a tan nd had great time :-), 7
Happy Veterans Day to all I have served with and all who has served!!, 7
maine :), 7
Thanks everybody for the wonderful birthday wishes!!! Luv ya! :), 7
I love the smell of spring, 7
Thanks to everyone for the Birthday Wishes!!, 7
"loves making friends through a battle of wits and a few bruises to the ego. Thanks everyone for the birthday wishes!!! (those who wished me a happy birthday, that is...)", 7
YAY! Finally 15! Thanks so much to everyone for wishing me a happy one!, 7
Rockband Karaoke at Buffalo Wild Wings! Come rock out at the Gay Bar!, 7
THE STREAK IS OVER!!! LIONS WIN!!!!!!!, 7
