"ATTENTION EVERYONE---There's a site called <URL> that's a new online phone book w/personal information: everything from pics you've posted on FB or web, your approx credit score, home value, income, age, etc. You can remove yourself by first searching for yourself on their site to find the URL of your page, then going to the Privacy button on the bottom of their page to remove yourself. Copy & repost", 5
is contemplating how to spend his Xbox points..., 5
la lingaw.. sleepy na.. work napud ugma. hehehe, 5
"After a discussion on the environment and our natural world (that we're destroying) a 7 year old raised her hand with something to say.,Well", 5
"yea, JETS.. shut up", 5
Someone should make a <PERSON> Facts website to compete against Chuck Norris., 5
A life of wisdom consists of being constantly engaged in letting go, 5
"i honestly never saw the enjoyment in watching people do physical activity, such as play football, who cares?", 5
I have no patience... hahaha...., 5
Has Anyone Else Realized That The People On Family Guy Only Have 4 Fingers?, 5
.--. Put this dog on .//^ ^\\\\ your profile (/(_ÃƒÂ¢Ã¢â€šÂ¬Ã‚Â¢_)\\) to show ._/''*''\\_ that you are (/_)^(_\\) against animal cruelty, 5
"It's true that we don't know what we've got until we lose it, but it's         also true that we don't know what we've been missing until it arrives.", 5
has nothing on her mind., 5
<PERSON> is fat. =] Very Fat, 5
Black hats sideways white bold LA, 5
"20 years ago, on a night just like tonight....road called roller coaster...", 5
"I feel like I should clean the house, so I am going to lay down until the feeling passes...:P*", 5
"There is a chicken and an egg in bed, chicken has head on pillow and is smoking. Egg rolls over annoyed and saysi guess we answered that question.\\""""", 5
I am bored, 5
Making love with my ego., 5
feels tight literally!, 5
"Note to self just because it says \Flammable\"" it doesnt mean its a sugguestion...\"" <PERSON>.\""""", 5
LOL how true 'Urban Dictionary' <PERSON> buy <PERSON> mugs, 5
........, 5
What does time mean to you? How would you define it?, 5
Stayed up till 4 last night playing overlord raising hell. how i do not know, 5
"If a doctor removed you still-living brain moments before you died, and kept it alive with a tank of fluid enriched with blood, and finally transplanted your brain into a patient whose own brain was severely damaged..which home would the patient return to.. yours or theirs?", 5
JELLYPUSS...., 5
Looking for more team mates please send me an invite, 5
Rest In Peace <PERSON> I Will Never Forget You., 5
CARE TO BE MY NEW FRIEND?, 5
dnt get scared.... jst missing my.... darling curles...., 5
Just got my Ipod Touch, 5
"is fed up of searching for info on The Man Who Knew Too Much\. Can anyone help?\""""", 5
Since im stuck in Morgantown....alchy-cider sledding, 5
"if theres a fat guy in a pastry shop with a twenty dollar bill and he's ready to buy, in order to predict his volume change you need to know the value of pi", 5
"I think <PERSON> is obsessed with me, and that is just weird....        jk", 5
Is anyone having a Halloween party on Halloween, 5
Time to log off ..., 5
Kinda upset at a couple friends but I might have a job so they aren't that important. Are they?, 5
answered a question on Friend FactsÃ¢â€žÂ¢, 5
likes hammering nails more than weeding paths, 5
"2 missed FG's, dammit!!! Still like <PERSON> though any kicker that gets in bar fights is cool with me, but seriously make those FG's!", 5
ok... just finished reading the latest bleach manga. so <PERSON> still plans to milk bleach even more by starting a new arc. I wonder if <PERSON> would start from scratch again here? it also looks like <PERSON> would have a bigger role., 5
shame on the West Indies :-( good luk for T&T :-), 5
is having a MRI done today...she prays 4 a answer 2 her pain and a healn n her body. God Bless FB., 5
So I finally became a member of facebook. Yay joy lets hear it for what boredome does to our minds...., 5
"With so much drama in the LBC, It's kinda hard bein' Snoop D-O double G, But I somehow, some way, keep comin', Up with funky-ass shit like every single day        May I kick a little somethin' for the G's and make a few ends as I, Breeze through two in tha mornin and the party's still jumpin, Cause my mama ain't home.", 5
"sorry to all the farmvill and mafia players... But, i dont think ill be doing that.", 5
I finally switched to swing.  We'll see if I can sleep at night., 5
Alcohol servers license class  in seaside.  Call <PHONE>, 5
Give the most perfect and simple situation to <PERSON>, 5
"((OOC: I'm probably going to work on my sisters house until 9 o'clock for the rest of the Summer Break.... D: Sorry <PERSON>, and <PERSON>. I can only RP for sometimes now... I need the energy to work.))", 5
"India Foxtrot Yankee Oscar Uniform <PERSON> Alpha November Uniform November Delta Echo<PERSON> Sierra Tango Alpha November Delta Tango Hotel India Sierra,<PERSON> Oscar Papa Yankee Alpha November Delta Papa Alpha Sierra Tango Echo Tango <PERSON> Yankee Oscar Uniform Romeo Sierra Tango Alpha Tango Uniform Sierra!!!", 5
We tied South but soooo should hav won!!!!!, 5
Reliving his childhood, 5
me to mom: remember that time i got a LD mom: phsch, 5
I am Logizomechanophobic!, 5
ROLL TIDE!!!!!, 5
"Will i ever get to where i'm going.... if i do, will i know when i am there?  If the wind blew me in the right direction, would i even care.... i would.", 5
Time to finish moving all my stuff.... lets hope it doesn't take too long, 5
I think I have to go back to work tomorrow., 5
Just about time to roll for FNM with White Eldrazi. We'll see how she plays., 5
<PERSON> is going insane!, 5
Who hasn't seen the Schroderhuis yet? Join me in shame! Audiotour tomorrow at 3 or 4., 5
missed!, 5
I HAVE NO MORE HAIR I WILL POST a pic later so im going to get ready and see what I got in store for me today peace, 5
"Weeded, tilled, weeded some more, composting, and fixing to till some more.", 5
A minute of action is equal to an infinite amount of prayer., 5
after living a certain way for so long can someone truly change who they are?, 5
i dont know what to wrtie in the box, 5
"Baby polar bear goes to his mother and asks, am i a real polar bear?\  \""yes of course. Why do you ask?\""  the baby replies""", 5
YAYERH!, 5
bowlingg today <3 hopefully i'll get higher than a 61 :-P, 5
Is it illegal to throw rocks at endangered species?, 5
Man...Ilove <PERSON> so much young...coming home tomar, 5
fell victim to a birthday prank!!!  Im gonna git you guys!!!!!!, 5
my last card..., 5
ALLLLLLLLloooooooooooooo, 5
Shades of Grey, 5
Who watched the video, 5
And in the end, 5
live love laugh think sleep work  and then die .........:P, 5
For many years millions of people have been trusting the mainstream media to releav their pain and suffering caused by........thinking about stuff!, 5
yaar mer a mobile no milana thaa i have very long emergency duties nowadays, 5
"is dead-scared yet smiley after a face-to-face meeting with Emma... cute lil'one, she is...", 5
time to oil my roadie..., 5
4 dollars and a ham sandwich!! -Anonymous professor, 5
If anyones interested im selling my ps3 eye toy camara for $20 or $25 so yeah. just comment if you want to buy one cause ive got 3 and i need to sell 2., 5
Why am I the only one who doesn't know how to upload pics from my phone to facebook?? Gotta figure this out...maybe its this damn palm centro I have!, 5
OMG 2010 creeping up, 5
Championship Or Nothing-Los Angeles Lakers, 5
tomorrow: birthday <3. sunday: singles awareness day :). monday: practice :/. text me?., 5
"says: Life is Music, Play it LOUDER", 5
"I hate this kind of status, but...I'm at work all day. So txt and I'll get back to you asap :) haha ewwww I did it, I caved to the FB monster!", 5
ON OUR WAY TO FLORIDA, 5
Sibling war! It's on!!! Copy and paste this if you are the sibling who spends way to much time on facebook!!!!!!!!!, 5
"I hurt ma foot evry1!!! :( me sad, haha not really! XOXOX", 5
Looks as if someone shook the snowglobe., 5
How ya doin peeps?, 5
I think about chicken soup!, 5
peeps bye... :P, 5
"Ã¢â‚¬Å“And in the end, it's not the years in your life that count. It's the life in your years.Ã¢â‚¬Â", 5
i only hope everyone go an vote unc on de 24th rather than they stay home an drink like dey win already, 5
once upon a time...i gave a shit, 5
"Here I sit @ my computer, suffering with a head cold. While Lil <PERSON> watches SpongeBob.", 5
"Everybodys got something they can give, and that can be prevented by using the dental dam.", 5
Ã¢â‚¬Å“A child's life is like a piece of paper on which every passerby leaves a mark.Ã¢â‚¬Â -Chinese proverb, 5
dead fb~LOL, 5
wat do u get when u grow your hair??????? greater and visible HAIRFALLLLL........!!!!!!!, 5
is going to bed to try to sleep!  aahhhh, 5
"Is spending another lazy day at home, and liking it.  Although admittedly it is becoming boring.  I may actually have to venture out and join the human race again.", 5
"How do you say Disip in Spanish Disip Gazzman Wilton Djkompa Disip Versace Michael Adolphe Chancy , I want tell my Dominican girlfriend since have never heard of any such name..She asked me if that the name of a drink...lol.", 5
About to take the JEOPARDY! Teen Test., 5
LOL this sight keeps telling two of my freinds are Idiots., 5
Mr. Rager - KiD CuDi, 5
watching my dog. anyone wanna do anything tonight?, 5
is a busy little bee., 5
try'n to figure out how to adopt this pet???, 5
Life ish about giving and takeing~ <3 .................................... *Whispers* But try to be the one who's takeing! XD, 5
"Two roads diverged in a wood, and IÃ¢â‚¬â€	I took the one less traveled by,	And that has made all the difference.", 5
Tinychat time! Click the link to come me - <URL>  (tinychat.com), 5
I have yet to acquire the taste for beer :P, 5
"Monday, yup!", 5
im not lazy ive just been overcome by gravity!!!, 5
haha jane your the only mate bawbag deleted!!!! pmsl hun.xxxxxxxxxx, 5
"Hey if  you had sex with you from another universe and the were the other gender what would called it and you had kid from that be a clone, just somthing i was wondering", 5
"kids are in bed, i'm watching tv and getting ready for bed also", 5
broncos to superbowl XLIV, 5
Can I make a little hole in the tank and drain them dead?... :P, 5
is thinking we need to invent a contraceptive for laundry baskets since every time I turn around it's reproduced!, 5
got a new pic does any1 like it?, 5
SOOOOOOOOOOOOOOOOOO FFFFUUUUUCCCKKIN TIRED I BEEN COOKIN ALL GOT DAMN DAY SHIT A NIGGA CANT GET NO KINDA BRAKE ITS ALL GOOD DOUGH LUCKY I LOVE MY MOM, 5
Need 2 b doing class work!, 5
Customer: I want a hot fudge sunday, 5
"For my birthday I would like my family (and friends of) to give me one memory of my Dad, no matter how small.", 5
"Choose your FRIEND very carefully, because they will become your INTRODUCTION!!!!!", 5
"CERTAIN THINGS R FUNNY TO ME......Y WHEN U TELL A GUY U GOT A MAN DEY STILL TRY TO GET DA DIGITS,BUT WHEN U DNT GIVE IT 2 EM' THEY WANNA TALK SH*T.... PLEASE HELPME UNDERSTAND LADIES (<PERSON> LICKER GO LICK URSELF U CORNBALL)", 5
More pics updated, 5
"says Happy Birthday to <PERSON>!!!\.... as deep depression sets in when I try to come to terms that I am the mother of a teenager......\""""", 5
Just had a dream of a design of a guitar amp and a guitar right now, 5
"Not my chair, not my problem thats what i always say! light houses rule!...lol", 5
IÃ¢â‚¬â„¢m selling a '07 Mustang GT in Nitto 1320 Legends! <URL>, 5
Never realised someone could be so self centred! I couldn't live with my self if I had to lie to myself to get to sleep at night. Yes I've Hurt people before but at least when I learn to admit i was wrong I don't expect to be imeadiatly forgiven        .. God damn it, 5
Manu won once again against the Arsenal......, 5
"Sent my big toe half way up my shin bone thanks to toe ala crunch\ via the door jamb........... Maybe It's time for new glasses? Foot reduction is also an option :)\""""", 5
college's closed till semester.....itz so cold n v hv been releived frm gtng up at 5 in d mrng..., 5
yo mamma is so stupid she sat down on theÃ¯Â»Â¿ tv and watched the couch HAHAHA!! just heard this today!! xD no offense to the moms but this is hilarious, 5
"Most frequent facebook word of the day: mindmap\.\""""", 5
How long could I stay in bed if I put my mind to it?, 5
...yii..., 5
20min, 5
zzzzzzzzzzzzzzzzzzzzz, 5
It's DoppelgÃƒÂ¤nger week! Change your profile picture to someone famous you have been told you look like., 5
i would like you to comment on jut in my head, 5
Just started a facebook... not entirely sure why., 5
"Met a girl, fell in love, glad as i can be met a girl, fell in love, glad as I can be But i think all the time, is she true to me? Cuz there's nothing in this world to stop me worryin bout that girl", 5
Hi, 5
im addicted to these facebook games, 5
Studying and cleaning and packing all long time still, 5
Last exam tomorrow - Math 9, 5
"All intelligent people should be cremated for reasons of public security.--The Amazing Screw On Head, and the show that really should have gotten onto Sci Fi.", 5
"If the king does not move, his subordinates will not follow", 5
I'm totally out of invites for Mafia! I'll get you all asap., 5
is wondering if there is anything interresting on tele tonight? :/ XXXXXX, 5
thinks that a person shouldn't wait until high school to show their true colors, 5
"love is confusing...a guy tells u ur gorgeous and he turns the lights off ,)", 5
ok god u can turn off the faucet now, 5
"here is a question I got stumped on for a little while taking a quiz. can anyone answer it? The three great unifiers of Japan were Oda Nobunaga, Toyotomi Hideyoshi, and Tokugawa Ieyasu. A popular poem exists about these unifiers. It reads:        If the bird does not sing, kill it.        If the bird does not sing, coax it.        If the bird does not sing, wait for it.        Which unifier coaxed\ the bird?\""""", 5
"Does anyone know, what time the game is at ?", 5
"I'm not sure I want to hear what you guys might come up with lol But, I'll go for it! If you read this", 5
"Enter through the narrow gate. For wide is the gate and broad is the road that leads to destruction, and many enter through it. But small is the gate and narrow the road that leads to life, and only a few find it. (Matthew 7:13-14)", 5
12 today, 5
everybody sing!!!!!!!!!!, 5
Anyone copy down all the things we were supposed to write about in the letter in English?, 5
"dear god, find me someone that will do me hard up the poop shoot", 5
"Should I be ashamed of enjoying 1980s Conan the Barbarian comic books? Their so cheesy and over the top sword and sorcery\ yet its so much fun.\""""", 5
Babysitting... laughs, 5
is doing some last minute packing!, 5
Your thoughts maketh your world., 5
"An American classmate who was learning Tagalog told the taxi driver, Ã¢â‚¬Å“Manong, pwede kant*t?Ã¢â‚¬Â (what he wanted to say was for the driver to drop him off at the corner)", 5
is watching 500 Days of Summer..., 5
my little sister is sitting in a ball rocking back and forth..., 5
I know my best friend is having the baby but I have been anxious since this morning I can not wait any longer for baby port!!, 5
is goin house hunting today., 5
"WHAT TURN DO I TAKE NOW? ONLY GOD KNOWS THE RIGHT ONE, I PRAY I HEAR HIM CLEARLY AND MAKE THE RIGHT ONE. FRIENDS AND FAMILY PRAY FOR YOUR BOY .", 5
i think ill hibenate this winty......, 5
MONDAY na ulit work work na ulit.... may God give me more strength and love, 5
bored...., 5
the gargoyle has landed, 5
... thank guys... Ã¤Â»Å Ã¦Â¬Â¡Ã¦Æ’Â³Ã¥â€â€Ã¨Â®Å Ã§Å“Å¸Ã©â„¢Â³Ã¤Â¼Â¯Ã©Æ’Â½Ã¥â€â€Ã¥Â¾â€”Ã¦Â´â€º......, 5
"Facebook friends:  HELP!!  I have had a lack of funny emails, add me email to your list PLEASE~!!  <EMAIL>", 5
9th day                Dedicated to Goddess Siddhidatri form of Durga the day is also observed as Mahanavami in many parts of the country. This form of Goddess Durga showers knowledge which makes each soul pure. People can wear Red/ White colour on this day., 5
Football V.S. Moniteau tommorow, 5
The difference between genius and stupidity is that genius has limits stupidity has no limits.- Albert Einstein, 5
scooby doo would be a better show if they had guns, 5
life is one big party when you're still young but who's gonna have your back when its all done... shaggy, 5
Counting days...second by second..., 5
back in semenyih!!, 5
Back to class....., 5
subway w/ my BFF <PERSON. <333.......oh & <PERSON> unfortuantely., 5
"Believes in God, re-post if you believe too. Please don't ignore, you are being tested. It says in the Bible, Deny me in front of everyone", 5
i need a doomkal?, 5
Guess what people. I'm in bed... won't be moving from here 'till Monday, 5
"Dr. Phil's Personality Test -- My Result: The Vain, Self-Centered Leader. <URL>", 5
Hmmmmm......, 5
"Call the Nestle Crunch Hotline at <PHONE>, When you are asked if you want to continue in English or Spanish, just wait quietly for about 10 seconds and you will smile. Promise! Keep going and press 4. Listen to the options...then press 7. don't give it away if you comment on this!", 5
thinkin bout everything, 5
rude tube is on!, 5
(12r4-5r2+8r-15)+(7r4+5r2+2r-9)=..., 5
<PERSON> tonight for some improv with <PERSON>., 5
"...... :) ..... :( ..... ,) ..... :P ...... <3 ........:* ........ :D .....:-/ ...... :'( ... :(", 5
is asking...can you keep a secret and never say it again?, 5
There's been something on my mind for a while now...., 5
off to work F.B. see you all later., 5
"copy this to your status and see what people rate you! 1=crazy, 2=i'd marry you, 3=talkative, 4=sarcastic, 5=i miss you, 6=goofy, 7=moody, 8=dumb, 9=mouthy, 10=spoilt, 11=random, 12=hot, 13=funny, 14=fit, 15=amazing, 16=tough, 17=cute, 18=gf/bf type, 19=player, 20=i love you, 21=gorgeous, 22=the best , 23=cool, 24=sweet, 25=intriguing", 5
"Realized at about midnight that I have the day off, now what to do with it....", 5
Gym time...then I need to fix my mohawk....hair on the sides is getting a little to long...just have to find the electric razor., 5
"ughh, crazy..i need some starbucks.. STAT!", 5
Family wax dayy, 5
Life's better bein' a pirate., 5
me hang-over!!!!!!, 5
Thinking about plans for Sunday..., 5
I am my sisters keeper., 5
"Two may talk together under the same roof for many years, yet never really meet; and two others at first speech are old friends", 5
Is going to 2sea for 2 days with his big brother any 1 need anything from there ?, 5
time for new scientist and chips b4 i head to manc i think, 5
"Hey guys do you remember Sunday Basket\ well it's back in the Croisee in the form of \""JAPS\""!!!\""""", 5
PREDATORS., 5
"its all fire and brimstone baby, so lets go outside, whatcha know bout the ways on the underside...???<3", 5
So...who wants what for Xmas now that Turkey day is over?, 5
"is getting sick of explaining her hair, her summer, and her fear of driving over and over. on the bright side, her love life has only been prodded at once in the two hours shes been there", 5
Remember to VOTE. 06/08/2010, 5
O mi wrd!!!! am sooooo tired from job-shadowin! Da KFM studio is kick-ass! Luv da grafitti wall, 5
every obsticle making possible possible even when winning is ilogical losers still far from optional, 5
LOVE IS THE LAW!!!, 5
Why was the washing machine laughing? Because it was taking the piss out the underpants., 5
Is there such a thing as earlobe cancer?, 5
<PERSON> is going to <PERSON> house 2 c the boy in the striped pajamas. <PERSON> is coming with!, 5
I wish they would show the cheerleaders more between plays..., 5
<PERSON> burnt the rice.  Sipsie liked it though!, 5
anyone know a reputable independant communittie or thougth of what i should do?, 5
not to sure if i like facebook, 5
is watching her husband zoom pass the window on a small pink quad bike, 5
Non-dairy creamer is flammable., 5
is starting to get obsessed with heavy metal concerts., 5
knows I've done well when I terrify people on my husband's page.....I will sleep well tonight :), 5
"Well, today was a pretty crappy day at school. But then I shared some laughs with my best friend. :D", 5
wondering which of the 4 movies I hire to watch first        1. The New Daughter (Thriller) - Kevin Costner        2. Crazy Heart (Drama) - Jeff Bridges & Maggie Gyllenhaal        3. The Bounty Hunter (Action) - Jennifer Aniston & Gerard Butler        4. Cirque Du Freak: The Vamipire's Assistant (Family) - Willem Dafoe & Salma Hayek, 5
had an usual day and night with <PERSON>, 5
no rain - no rainbow., 5
is addicted to Dragon Age., 5
"on 2nd july,2009...gayism was legalised by HC...was it intended 2 b ma b'day present frm HC...gosh..it took me sooo long 2 realize dis..:P", 5
Experience is simply the name we give our mistakes., 5
wishes she was going to North Carolina with her gorgeous sisters<PERSON> and <PERSON>., 5
Tengen Toppa Gurren Lagann... it will make any day better, 5
A Lonely September Ã¢â„¢Âª, 5
So that was fun....., 5
OOO! OOO! OOO! OOO! Come On! <URL>, 5
<URL>, 5
"Ã¢â‚¬Å“With a full glass and an empty heart, I search for something to occupy my mindÃ¢â‚¬Â", 5
"Tupac might be gone bah he will always be alive in me and everyone out der who has feelins fa G! I rest my case,and say that he was and still remains a true soldier up der in da ghetto heaven", 5
"Okey dokey, time to scan this newspaper of mine...", 5
sometimes people put up walls, 5
"Was doing course evaluations for MedSoc and came up the question Instructor maintained positive environment in class\ - very nice timing for the video\""""", 5
"Nevr criticize ur bf's faults,rembr it may hv been these litle imperfections dat stoped him frm geting a beter gf....", 5
Just wanna curl up in a ball to sleep and hope when I wake up ill magically feel a hundred percent, 5
flying back to bangkok for a shoot..., 5
Varsity Athlete, 5
"FACEBOOK TRICK: press up,up, down, down, left, right, left, right, B, A, Enter key, then left click and magic crcles will appear. the only way to get rid of them are to log off or refresh the page...IT WILL WORK! put this as your status if it works. <-- freaked me out so bad. :O", 5
What's on your mind?, 5
people on my wall  if you read this please name your favourite tractor, 5
bed time nite world, 5
"If you dont like the new FB, here is how you can change it back to the old. Look to the top left menu and click on MORE. Then drag STATUS UPDATES to the top. After dragging to top, click on it. That becomes your default and it is like before. Pass it on", 5
"Is there some kind of tutorial for Facebook?  If so, will someone please send it to my Grandma?  She needs a little extra help. (Just kidding, g-ma-Chris and I will keep helping you.)", 5
Bmx starts next week., 5
what kind of bees make milk..., 5
Through god all things are possible........ yet our greatest treasure....... most turn away....... they turn away gods love....... i say that we have a purpose and that through god we can accomplish it........... dont turn away from the savior........ he will make like good....... peaceful......... as the world hated him they will hate us as christains.......... i speak for my self that when he calls my name, 5
I NEED A JOB!!!! anyone know of anything?, 5
"All night with <PERSON> and <PERSON> at <PERSON> to see Combichrist.  FUCK I LOVED THE SHOW.  Absolutely need to pass out, long work week + six hour concert = TIRED AS SHIT", 5
i'm happy and sad at the same time... di kaya nababaliw na ko? ^^, 5
hi everyone i have nothing to say so i will say hi everyone, 5
Tired of <PERSON> saying I look like a asian lol :'D, 5
"If you died today, who would be taking care of the arrangements and would he or she be paying for it...that is what is on my mind.  Due to my new profession, I am currently welcoming any and all death jokes (okay, maybe not all, I would rather not have my", 5
is bored and many going to start her science project, 5
Sigh....., 5
We begin from the recognition that all beings cherish happiness and do not want suffering. It then becomes both morally wrong and pragmatically unwise to pursue only one's own happiness oblivious to the feelings and aspirations of all others who surround us as members of the same human family. The wiser course is to think of others when pursuing our own happiness., 5
"Name:___________ Age:________Birthday:___________Eye color:_________ Nickname:___________ Favorite color:___________ Favorite Drink:________ My best friend:________Post this to your wall and see who all comments,and who knows you best", 5
Bama going to kick some ass, 5
"Day 4 menu: Sausage , egg and CHEESE biscuit, lunch: bacon and CHEESE burger, snack: Hashbrowns with CHEESE.........Day 5 idk!   I'm starting to get the bubble guts.....my stomach is doing strange stuff.....lol", 5
Sleepy, 5
Just saw this chinese dude get off the metro with chinese food in his hand...and was about to go make a delivery LMAO....he was all in a hurry dwl, 5
"1 final down, 1 to go!", 5
"back at home, and back to reality....", 5
there is a fine thin line between wrong and right., 5
has anyone taken the history finals?, 5
<PERSON> u have issuse lmao, 5
this is how you remind me, 5
Ind Vs Srilanka - A Thrilling match in progress....India need 65 ..5 wickets in hand.., 5
"In the land of the blinds, One eye man is a king.", 5
DONE, 5
hi, 5
Homework, 5
Time to go shovel the snow., 5
Relationships are like glass. Sometimes it is better to leave them broken than try to hurt yourself putting it back together......:), 5
I hope I get my voice back before saturday., 5
"I am perfectly imperfect, beautiful in my flaws, sure of my insecurities, absolute chaos..a beautiful disaster", 5
of course not! youre brain washed!, 5
